{
 "rcept_no": "20260305001174",
 "original_rcept_no": "20260223001080",
 "related_rcept_nos": [
  "20260223001080",
  "20260220002255"
 ],
 "filing_type": "증권신고서",
 "report_nm": "[기재정정]증권신고서(분할)",
 "source_grade": "full",
 "company": {
  "corp_code": "01087477",
  "name": "아이지에이웍스",
  "market": "기타",
  "induty_code": "5821"
 },
 "deal": {
  "type": "split",
  "counterparty": null,
  "counterparty_listed": null,
  "related_party": null,
  "relation_text": null,
  "board_date": "2026-02-20",
  "regime": null,
  "ratio_text": "분할존속회사 : 0.6295736 / 분할신설회사 : 0.3704264 (신주배정비율 1주당 1주)",
  "status": "완료",
  "status_source": "20260504000270",
  "status_checked": "2026-10-27",
  "spac": false,
  "spac_basis": "합병·분할합병 아님"
 },
 "external_valuation": {
  "required": false,
  "exemption_reason": "단순·인적분할: 2025년 6월 30일 재무상태표 기준 순자산 장부가액 비율로 분할비율 산정(외부평가기관 없음)",
  "basis_text": null,
  "firm": null,
  "firm_type": null,
  "period": null,
  "audit_committee_consent": null,
  "standards_cited": [],
  "opinion_text": null,
  "cite": {
   "section_id": "3.4",
   "offset": 348,
   "file_id": "main"
  }
 },
 "valuations": [
  {
   "subject": "아이지에이웍스",
   "target": "트레이딩웍스(가칭)",
   "role": "회사",
   "purpose": "분할·교환비율",
   "method": "자산가치",
   "weights": null,
   "asset_value": {
    "per_share": null,
    "total": {
     "value": 16323112063,
     "unit": "원",
     "text": "16,323,112,063원",
     "cite": {
      "section_id": "5",
      "offset": 552,
      "file_id": "main"
     }
    },
    "equity_book": {
     "value": 44065733705,
     "unit": "원",
     "text": "44,065,733,705원",
     "cite": {
      "section_id": "5",
      "offset": 583,
      "file_id": "main"
     }
    },
    "adjustments": null,
    "shares": null,
    "base_date": "2025-06-30"
   },
   "dcf": null,
   "relative": null,
   "result": {
    "value": {
     "value": 0.3704264,
     "unit": null,
     "text": "0.3704264",
     "cite": {
      "section_id": "5",
      "offset": 624,
      "file_id": "main"
     }
    },
    "unit": null,
    "range": null
   },
   "note": "분할비율 = 분할대상부문 순자산가액 ÷ (분할 전 순자산가액 + 자기주식 장부가액 0원). asset_value.total은 분할대상부문(신설회사) 순자산 장부가액, equity_book은 분할 전 순자산 장부가액. result.value는 분할신설회사 분할비율(무단위). 할인율·멀티플 등 평가 가정 없음. 신주 35,996,605주."
  }
 ],
 "conclusion": {
  "price_per_share": [
   {
    "company": "트레이딩웍스(가칭)",
    "basis": "분할신주 모집(매출)가액(모집총액 ÷ 발행주식총수)",
    "value": {
     "value": 453,
     "unit": "원",
     "text": "453",
     "cite": {
      "section_id": "3.4",
      "offset": 450,
      "file_id": "main"
     }
    }
   }
  ],
  "range": [],
  "ratio": {
   "value": 0.3704264,
   "unit": null,
   "text": "0.3704264",
   "cite": {
    "section_id": "5",
    "offset": 624,
    "file_id": "main"
   }
  },
  "transaction_value": {
   "value": 16323112063,
   "unit": "원",
   "text": "16,323,112,063원",
   "cite": {
    "section_id": "5",
    "offset": 552,
    "file_id": "main"
   }
  },
  "opinion_text": "순자산 장부가액 기준 분할비율(존속 0.6295736 / 신설 0.3704264). 소액주주 보호를 위해 신주배정비율은 1주당 1주로 분할비율과 다르게 정함",
  "unit": "원"
 },
 "sensitivity": [],
 "ipo": null,
 "notes": [
  "MCP 대신 직접 호출: dart 툴을 dart_mcp.casebuild call로 dart_mcp.server 함수 직접 호출. 배치 실행이라 리뷰 생략.",
  "search_valuation_disclosures(20251006–20260404, listed_only=False): 분할/full, 기재정정, 원본 20260223001080, 짝 주요사항보고서(회사분할결정) 20260220002255.",
  "단순·인적분할로 외부평가기관 '없음'(IV. 평가 및 신주배정 등). 가치평가(DCF·상대가치 등)는 없고 순자산 장부가액 비율만 있음.",
  "conclusion.ratio는 분할신설회사 분할비율(무단위), transaction_value는 분할대상부문 순자산가액. 신주 35,996,605주(분할회사 주식수와 동일, 1주당 1주), 액면가 100원.",
  "분할기일 2026-05-01, 분할 신주배정 기준일 2026-04-30. 분할회사는 비상장법인(원문)."
 ],
 "extracted_at": "2026-10-26T15:41:38+09:00",
 "extractor_version": "1.1",
 "citations": [
  {
   "rcept_no": "20260305001174",
   "file_id": "main",
   "section_id": "3.4",
   "title": "IV. 평가 및 신주배정 등",
   "chars_read": 1988,
   "how": "section"
  },
  {
   "rcept_no": "20260305001174",
   "file_id": "main",
   "section_id": "5",
   "title": "II. 분할 가액 및 그 산출근거",
   "chars_read": 3468,
   "how": "section"
  }
 ],
 "absent_reasons": [
  {
   "path": "relative",
   "field": "relative",
   "reason": "해당 없음",
   "basis": "키워드 감사 2026-10-27: 분할은 상대가치 비교 대상이 아니다(시행세칙 제7조는 합병가액)"
  }
 ]
}