{
 "rcept_no": "20260212001569",
 "original_rcept_no": "20260113000727",
 "related_rcept_nos": [],
 "filing_type": "증권신고서",
 "report_nm": "[발행조건확정]증권신고서(지분증권)",
 "source_grade": "full",
 "company": {
  "corp_code": "01203312",
  "name": "케이뱅크",
  "market": "유가증권",
  "induty_code": "64121"
 },
 "deal": {
  "type": "ipo",
  "counterparty": null,
  "counterparty_listed": null,
  "related_party": null,
  "relation_text": null,
  "board_date": null,
  "regime": "IPO",
  "ratio_text": null
 },
 "external_valuation": {
  "required": false,
  "exemption_reason": "IPO: 자본시장법 시행령 176조의5 외부평가 대상이 아님(공모가는 공동대표주관회사가 산정)",
  "basis_text": "청약일 전에 실시하는 수요예측 결과를 반영하여 공동대표주관회사인 NH투자증권㈜, 삼성증권㈜와 발행회사인 ㈜케이뱅크가 협의하여 1주당 확정공모가액을 8,300원으로 최종 결정하였습니다.",
  "firm": null,
  "firm_type": null,
  "period": null,
  "audit_committee_consent": null,
  "standards_cited": [],
  "opinion_text": "공동대표주관회사가 희망공모가액 8,300원–9,500원을 제시했고, 수요예측 결과 및 주식시장 상황을 감안해 발행회사와 협의하여 확정공모가액을 8,300원으로 결정",
  "cite": {
   "section_id": "0",
   "offset": 6713,
   "file_id": "main"
  }
 },
 "valuations": [
  {
   "subject": "NH투자증권㈜·삼성증권㈜(공동대표주관회사)",
   "target": "케이뱅크",
   "role": "주관사",
   "purpose": "공모가",
   "method": "상대가치",
   "weights": null,
   "asset_value": null,
   "dcf": null,
   "relative": {
    "multiple_type": "PBR",
    "peers": [],
    "multiple": {
     "value": 1.8,
     "unit": "배",
     "text": "1.80",
     "cite": {
      "section_id": "0",
      "offset": 124101,
      "file_id": "main"
     }
    },
    "applied_earnings": {
     "value": 2192268,
     "unit": "백만원",
     "text": "2,192,268",
     "cite": {
      "section_id": "0",
      "offset": 123959,
      "file_id": "main"
     }
    },
    "discount_range": {
     "min": {
      "value": 7.65,
      "unit": "%",
      "text": "7.65%",
      "cite": {
       "section_id": "0",
       "offset": 124614,
       "file_id": "main"
      }
     },
     "max": {
      "value": 19.32,
      "unit": "%",
      "text": "19.32%",
      "cite": {
       "section_id": "0",
       "offset": 124622,
       "file_id": "main"
      }
     }
    },
    "not_applied_reason": null
   },
   "result": {
    "value": {
     "value": 10287,
     "unit": "원",
     "text": "10,287",
     "cite": {
      "section_id": "0",
      "offset": 124482,
      "file_id": "main"
     }
    },
    "unit": "원",
    "range": {
     "min": {
      "value": 8300,
      "unit": "원",
      "text": "8,300원",
      "cite": {
       "section_id": "0",
       "offset": 129261,
       "file_id": "main"
      }
     },
     "max": {
      "value": 9500,
      "unit": "원",
      "text": "9,500원",
      "cite": {
       "section_id": "0",
       "offset": 129270,
       "file_id": "main"
      }
     }
    }
   },
   "note": "result.value는 할인 전 주당 평가가액, result.range는 할인 후 희망공모가액 밴드. 적용산식 {2025년 3분기 자본총계 × 유사기업 PBR + 공모자금 유입액} ÷ 주식수 × (1-할인율). Implied PBR(평가시가총액 기준) 1.72배, 희망 밴드 기준 1.38–1.56배. 비교회사별 PBR 표는 이 정정본에 없음"
  }
 ],
 "conclusion": {
  "price_per_share": [
   {
    "company": "케이뱅크",
    "basis": "확정공모가액",
    "value": {
     "value": 8300,
     "unit": "원",
     "text": "8,300원",
     "cite": {
      "section_id": "0",
      "offset": 125659,
      "file_id": "main"
     }
    }
   },
   {
    "company": "케이뱅크",
    "basis": "PBR 주당 평가가액(할인 전)",
    "value": {
     "value": 10287,
     "unit": "원",
     "text": "10,287",
     "cite": {
      "section_id": "0",
      "offset": 124482,
      "file_id": "main"
     }
    }
   }
  ],
  "range": [
   {
    "label": "희망공모가액 밴드",
    "subject": "NH투자증권㈜·삼성증권㈜(공동대표주관회사)",
    "range": {
     "min": {
      "value": 8300,
      "unit": "원",
      "text": "8,300원",
      "cite": {
       "section_id": "0",
       "offset": 129261,
       "file_id": "main"
      }
     },
     "max": {
      "value": 9500,
      "unit": "원",
      "text": "9,500원",
      "cite": {
       "section_id": "0",
       "offset": 129270,
       "file_id": "main"
      }
     }
    }
   }
  ],
  "ratio": null,
  "opinion_text": "수요예측 결과 및 주식시장 상황 등을 감안하여 공동대표주관회사와 발행회사가 협의하여 확정공모가액을 8,300원으로 최종 결정",
  "unit": "원"
 },
 "sensitivity": [],
 "ipo": {
  "underwriter": "NH투자증권㈜, 삼성증권㈜(공동대표주관회사)",
  "method": "상대가치법",
  "multiple_type": "PBR",
  "excluded_multiples": [],
  "applied_earnings": {
   "value": 2192268,
   "unit": "백만원",
   "text": "2,192,268",
   "cite": {
    "section_id": "0",
    "offset": 123959,
    "file_id": "main"
   }
  },
  "applied_earnings_basis": "실적치(2025년 3분기 기준 자본총계)",
  "multiple": {
   "value": 1.8,
   "unit": "배",
   "text": "1.80",
   "cite": {
    "section_id": "0",
    "offset": 124101,
    "file_id": "main"
   }
  },
  "shares": {
   "value": 407535286,
   "unit": "주",
   "text": "407,535,286",
   "cite": {
    "section_id": "0",
    "offset": 124345,
    "file_id": "main"
   }
  },
  "value_per_share": {
   "value": 10287,
   "unit": "원",
   "text": "10,287",
   "cite": {
    "section_id": "0",
    "offset": 124482,
    "file_id": "main"
   }
  },
  "discount_range": {
   "min": {
    "value": 7.65,
    "unit": "%",
    "text": "7.65%",
    "cite": {
     "section_id": "0",
     "offset": 124614,
     "file_id": "main"
    }
   },
   "max": {
    "value": 19.32,
    "unit": "%",
    "text": "19.32%",
    "cite": {
     "section_id": "0",
     "offset": 124622,
     "file_id": "main"
    }
   }
  },
  "price_band": {
   "min": {
    "value": 8300,
    "unit": "원",
    "text": "8,300원",
    "cite": {
     "section_id": "0",
     "offset": 129261,
     "file_id": "main"
    }
   },
   "max": {
    "value": 9500,
    "unit": "원",
    "text": "9,500원",
    "cite": {
     "section_id": "0",
     "offset": 129270,
     "file_id": "main"
    }
   }
  },
  "peers": [],
  "external_comparison": null
 },
 "citations": [
  {
   "rcept_no": "20260212001569",
   "file_id": "main",
   "section_id": "0",
   "title": "(표지 및 섹션 외 본문)",
   "chars_read": 15238,
   "how": "search/section"
  }
 ],
 "notes": [
  "MCP 대신 직접 호출: dart_mcp.casebuild call로 dart_mcp.server 함수를 직접 불렀다.",
  "배치 실행: 등급·짝 정보는 배치 계획(_batch_2026-10-26.json, search_valuation_disclosures 결과)에서 가져옴. 최초 제출 20260113000727, 중간 정정 20260129000644.",
  "발행조건확정 정정본은 섹션 구분 없이 단일 본문(section 0)이며 정정 전/후 대비만 있다. 값은 '정정 후' 블록에서 옮겼다.",
  "공모자금 유입액 249,000백만원은 원문 인수 표의 모집 합계 30,000,000주·249,000,000,000원(section 0, offset 13626 부근)과 같은 금액.",
  "할인율 원문 표기 '7.65% ~ 19.32%'(상단 9,500원 ↔ 7.65%, 하단 8,300원 ↔ 19.32% — 추정: 10,287원×(1-할인율) 대응). discount_range는 min 7.65·max 19.32.",
  "비교회사 선정·개별 PBR 표('(2) 비교회사 PBR 산출')는 이 정정본에 없음 → peers 빈 배열. 필요하면 20260129000644 본문에서 보완.",
  "금융업(은행) IPO: PBR 단일 멀티플. 외부평가·DCF 없음."
 ],
 "extracted_at": "2026-10-26T15:28:54+09:00",
 "extractor_version": "1.1"
}