{
 "rcept_no": "20260710000294",
 "original_rcept_no": "20260616000156",
 "related_rcept_nos": [
  "20260616000156",
  "20260702000548",
  "20260706000283"
 ],
 "filing_type": "증권신고서",
 "report_nm": "[발행조건확정]증권신고서(지분증권)",
 "source_grade": "full",
 "company": {
  "corp_code": "00624244",
  "name": "에이치엘지노믹스",
  "market": "코스닥",
  "induty_code": "211"
 },
 "deal": {
  "type": "ipo",
  "counterparty": null,
  "counterparty_listed": null,
  "related_party": null,
  "relation_text": null,
  "board_date": null,
  "regime": "IPO",
  "ratio_text": null,
  "spac": false,
  "spac_basis": "합병·분할합병 아님"
 },
 "external_valuation": {
  "required": false,
  "exemption_reason": "IPO: 자본시장법 시행령 176조의5 외부평가 대상이 아님(공모가는 주관회사가 산정)",
  "basis_text": null,
  "firm": null,
  "firm_type": null,
  "period": null,
  "audit_committee_consent": null,
  "standards_cited": [],
  "opinion_text": "대표주관회사 KB증권·공동주관회사 IBK투자증권이 EV/EBITDA 상대가치법으로 주당 평가가액 26,858원을 산출하고 31.1%~20.0% 할인율을 적용해 희망공모가액 18,500원~21,500원을 제시, 수요예측 결과 및 주식시장 상황 등을 감안해 발행회사와 협의하여 확정공모가액 21,500원으로 결정",
  "cite": {
   "section_id": "0",
   "offset": 210904,
   "file_id": "main"
  }
 },
 "valuations": [
  {
   "subject": "케이비증권㈜ (대표주관회사), 아이비케이투자증권㈜ (공동주관회사)",
   "target": "에이치엘지노믹스",
   "role": "주관사",
   "purpose": "공모가",
   "method": "상대가치",
   "weights": null,
   "asset_value": null,
   "dcf": null,
   "relative": {
    "multiple_type": "EV/EBITDA",
    "peers": [],
    "multiple": {
     "value": 12.85,
     "unit": "배",
     "text": "12.85x",
     "cite": {
      "section_id": "0",
      "offset": 212768,
      "file_id": "main"
     }
    },
    "applied_earnings": {
     "value": 10926,
     "unit": "백만원",
     "text": "10,926백만원",
     "cite": {
      "section_id": "0",
      "offset": 212718,
      "file_id": "main"
     }
    },
    "discount_range": {
     "min": {
      "value": 20.0,
      "unit": "%",
      "text": "20.0%",
      "cite": {
       "section_id": "0",
       "offset": 218317,
       "file_id": "main"
      }
     },
     "max": {
      "value": 31.1,
      "unit": "%",
      "text": "31.1%",
      "cite": {
       "section_id": "0",
       "offset": 218309,
       "file_id": "main"
      }
     }
    },
    "not_applied_reason": null
   },
   "result": {
    "value": {
     "value": 26858,
     "unit": "원",
     "text": "26,858원",
     "cite": {
      "section_id": "0",
      "offset": 212940,
      "file_id": "main"
     }
    },
    "unit": "원",
    "range": {
     "min": {
      "value": 18500,
      "unit": "원",
      "text": "18,500원",
      "cite": {
       "section_id": "0",
       "offset": 218339,
       "file_id": "main"
      }
     },
     "max": {
      "value": 21500,
      "unit": "원",
      "text": "21,500원",
      "cite": {
       "section_id": "0",
       "offset": 218349,
       "file_id": "main"
      }
     }
    }
   },
   "note": "적용산식: {2026년 1분기 LTM EBITDA x 비교기업 평균 EV/EBITDA - 순차입금} ÷ 공모 후 주식수 x {1-할인율}. 적정시가총액 209,016백만원, 순차입금 -68,580백만원(공모금액 하단 기준 공모자금 유입액 31,635백만원 포함). result.value는 할인 전 주당 평가가액, range는 희망공모가액 밴드. 비교기업 목록·개별 EV/EBITDA는 이 발행조건확정 정정본에 없음('(중략)')"
  }
 ],
 "conclusion": {
  "price_per_share": [
   {
    "company": "에이치엘지노믹스",
    "basis": "EV/EBITDA 주당 평가가액(할인 전)",
    "value": {
     "value": 26858,
     "unit": "원",
     "text": "26,858원",
     "cite": {
      "section_id": "0",
      "offset": 212940,
      "file_id": "main"
     }
    }
   },
   {
    "company": "에이치엘지노믹스",
    "basis": "확정 공모가액",
    "value": {
     "value": 21500,
     "unit": "원",
     "text": "21,500원",
     "cite": {
      "section_id": "0",
      "offset": 218375,
      "file_id": "main"
     }
    }
   }
  ],
  "range": [
   {
    "label": "희망공모가액 밴드",
    "subject": "케이비증권㈜ (대표주관회사), 아이비케이투자증권㈜ (공동주관회사)",
    "range": {
     "min": {
      "value": 18500,
      "unit": "원",
      "text": "18,500원",
      "cite": {
       "section_id": "0",
       "offset": 218339,
       "file_id": "main"
      }
     },
     "max": {
      "value": 21500,
      "unit": "원",
      "text": "21,500원",
      "cite": {
       "section_id": "0",
       "offset": 218349,
       "file_id": "main"
      }
     }
    }
   }
  ],
  "ratio": null,
  "transaction_value": {
   "value": 55147500000,
   "unit": "원",
   "text": "55,147,500,000원",
   "cite": {
    "section_id": "0",
    "offset": 406,
    "file_id": "main"
   }
  },
  "opinion_text": "수요예측 결과 및 주식시장 상황 등을 감안하여 발행회사와 협의한 후 확정공모가액을 21,500원(밴드 상단)으로 최종 결정",
  "unit": "원"
 },
 "sensitivity": [],
 "ipo": {
  "underwriter": "케이비증권㈜ (대표주관회사), 아이비케이투자증권㈜ (공동주관회사)",
  "method": "상대가치법",
  "multiple_type": "EV/EBITDA",
  "excluded_multiples": [],
  "applied_earnings": {
   "value": 10926,
   "unit": "백만원",
   "text": "10,926백만원",
   "cite": {
    "section_id": "0",
    "offset": 212718,
    "file_id": "main"
   }
  },
  "applied_earnings_basis": "2026년 1분기 기준 과거 12개월(LTM) EBITDA",
  "multiple": {
   "value": 12.85,
   "unit": "배",
   "text": "12.85x",
   "cite": {
    "section_id": "0",
    "offset": 212768,
    "file_id": "main"
   }
  },
  "shares": {
   "value": 7782161,
   "unit": "주",
   "text": "7,782,161주",
   "cite": {
    "section_id": "0",
    "offset": 212891,
    "file_id": "main"
   }
  },
  "value_per_share": {
   "value": 26858,
   "unit": "원",
   "text": "26,858원",
   "cite": {
    "section_id": "0",
    "offset": 212940,
    "file_id": "main"
   }
  },
  "discount_range": {
   "min": {
    "value": 20.0,
    "unit": "%",
    "text": "20.0%",
    "cite": {
     "section_id": "0",
     "offset": 218317,
     "file_id": "main"
    }
   },
   "max": {
    "value": 31.1,
    "unit": "%",
    "text": "31.1%",
    "cite": {
     "section_id": "0",
     "offset": 218309,
     "file_id": "main"
    }
   }
  },
  "price_band": {
   "min": {
    "value": 18500,
    "unit": "원",
    "text": "18,500원",
    "cite": {
     "section_id": "0",
     "offset": 218339,
     "file_id": "main"
    }
   },
   "max": {
    "value": 21500,
    "unit": "원",
    "text": "21,500원",
    "cite": {
     "section_id": "0",
     "offset": 218349,
     "file_id": "main"
    }
   }
  },
  "peers": [],
  "external_comparison": null
 },
 "notes": [
  "MCP 대신 직접 호출: dart 툴을 dart_mcp.casebuild call로 dart_mcp.server 함수 직접 호출. 배치 실행이라 리뷰 생략.",
  "search_valuation_disclosures(20260211–20260809, listed_only=False) 결과에 이 rcept_no가 없어 outline 문서명(증권신고서(지분증권), 증권발행조건확정)으로 full 판단. 원본 20260616000156·supersedes(20260702000548·20260706000283)는 배치 목록(reports/valuations/_batch_2026-10-26.json) 기준.",
  "발행조건확정 정정본은 정정 전/후 대비만 담아 outline이 섹션 '0' 하나다. 값은 '(주13) 정정 후'(공모가 산정 요약표·가. 평가 결과), '(주14) 정정 후'(EV/EBITDA 주당 평가가액 산출), '(주15) 정정 후'(희망공모가액 결정)에서 옮겼다.",
  "정정 전(주14) 대비 공모 후 주식수 7,764,054주 → 7,782,161주(주관사 의무인수 54,054 → 72,161주: Min(공모주식수 3.0%, 10억원) + 공모주식수 1.0%), 주당 평가가격 26,921원 → 26,858원.",
  "비교기업 선정·개별 EV/EBITDA 등 상세 산출은 이 정정본에 없음('(중략)'). 원본 20260616000156(또는 최근 기재정정 20260706000283)을 /dart-valuation으로 따로 뽑으면 보완된다.",
  "할인율 원문 표기: 요약표·산출내역표 '31.1% ~ 20.0%', 본문 서술 '31.12% ~ 19.95%'. 비교: 2023년 이후 코스닥 일반상장법인 평가액 대비 할인율 평균 하단 33.93%·상단 22.43%((주15) 주1)).",
  "코스닥시장 상장 공모(일반상장 비교군), 대표주관회사 케이비증권·공동주관회사 아이비케이투자증권 총액인수. 공모 2,565,000주(액면 500원), 확정총액 55,147,500,000원, 청약 2026-07-13~14, 납입 2026-07-16. market은 상장 후 조회 기준 코스닥."
 ],
 "extracted_at": "2026-10-26T15:56:43+09:00",
 "extractor_version": "1.1",
 "citations": [
  {
   "rcept_no": "20260710000294",
   "file_id": "main",
   "section_id": "0",
   "title": "(표지 및 섹션 외 본문)",
   "chars_read": 22562,
   "how": "search/section"
  }
 ]
}